Word,Description,Hint
진료비,"병원에서 치료받을 때 지불하는 비용으로 의료서비스의 대가인 이것은 무엇일까요?",앞글자 '진'
의료보험,"질병이나 상해 시 의료비 부담을 덜어주는 보험으로 국민건강을 지키는 이것은 무엇일까요?",앞글자 '의'
상해보험,"사고나 부상으로 인한 피해를 보상하는 보험으로 신체적 위험을 대비하는 이것은 무엇일까요?",앞글자 '상'
실손보험,"실제 발생한 의료비를 보상해주는 보험으로 의료비 부담을 덜어주는 이것은 무엇일까요?",앞글자 '실'
공연료,"공연을 관람하기 위해 지불하는 비용으로 문화예술 향유에 필요한 이것은 무엇일까요?",앞글자 '공'
환전,"자국 화폐를 외국 화폐로 바꾸는 것으로 해외여행에 필요한 이것은 무엇일까요?",앞글자 '환'
숙박비,"여행 중 잠자리에 드는 비용으로 숙소 이용에 필요한 이것은 무엇일까요?",앞글자 '숙'
교통비,"이동수단을 이용하는데 드는 비용으로 이동에 필요한 이것은 무엇일까요?",앞글자 '교'
여행자보험,"여행 중 발생할 수 있는 사고에 대비하는 보험으로 안전한 여행을 위한 이것은 무엇일까요?",앞글자 '여'
장난감,"놀이에 사용되는 물건으로 어린이의 즐거움을 위한 이것은 무엇일까요?",앞글자 '장'
문구류,"공부나 사무에 필요한 물품으로 필기구와 같은 이것은 무엇일까요?",앞글자 '문'
학용품,"학교생활에 필요한 물품으로 공부에 사용되는 이것은 무엇일까요?",앞글자 '학'
선물,"다른 사람에게 주는 물건으로 마음을 전하는 이것은 무엇일까요?",앞글자 '선'
기프티콘,"모바일로 선물하는 상품권으로 디지털 선물의 대표격인 이것은 무엇일까요?",앞글자 '기'
답례품,"받은 선물에 대한 보답으로 주는 물건으로 감사의 표시인 이것은 무엇일까요?",앞글자 '답'
축하금,"특별한 날을 축하하며 주는 돈으로 축하의 마음을 담은 이것은 무엇일까요?",앞글자 '축'
상품권,"물건이나 서비스를 살 수 있는 증서로 선물용으로 자주 사용되는 이것은 무엇일까요?",앞글자 '상'
천연자원,"자연에서 얻을 수 있는 귀중한 자원으로 경제활동의 기반이 되는 이것은 무엇일까요?",앞글자 '천'
재생에너지,"태양광이나 풍력처럼 고갈되지 않고 다시 사용할 수 있는 에너지로 친환경적인 이것은 무엇일까요?",앞글자 '재'
자원순환,"자원을 재활용하여 계속 사용하는 체계로 지속가능한 발전을 위한 이것은 무엇일까요?",앞글자 '자'
에너지비용,"전기나 가스 등 에너지 사용에 드는 비용으로 필수 지출항목인 이것은 무엇일까요?",앞글자 '에'
정기구독,"일정 기간마다 정기적으로 이용료를 내고 서비스를 이용하는 방식으로 새로운 소비트렌드인 이것은 무엇일까요?",앞글자 '정'
멤버십,"회원 자격을 얻어 특별한 혜택을 받는 제도로 고객 충성도를 높이는 이것은 무엇일까요?",앞글자 '멤'
이용권,"정해진 기간 동안 서비스를 이용할 수 있는 권리로 시설이나 서비스 이용시 필요한 이것은 무엇일까요?",앞글자 '이'
월정액,"매월 정기적으로 지불하는 금액으로 구독경제의 기본이 되는 이것은 무엇일까요?",앞글자 '월'
구독서비스,"정기적으로 이용료를 내고 지속적으로 제공받는 서비스로 편리한 이용이 가능한 이것은 무엇일까요?",앞글자 '구'
과제준비,"학교 숙제를 위해 필요한 준비물을 마련하는 것으로 학습에 필요한 이것은 무엇일까요?",앞글자 '과'
학원비,"학원에서 교육을 받기 위해 지불하는 비용으로 사교육비의 대표격인 이것은 무엇일까요?",앞글자 '학'
교재비,"공부에 필요한 책이나 자료를 구입하는 비용으로 학습에 필요한 이것은 무엇일까요?",앞글자 '교'
온라인강의,"인터넷을 통해 수강하는 강의로 비대면 학습의 대표적인 이것은 무엇일까요?",앞글자 '온'
과외비,"개인교습을 받기 위해 지불하는 비용으로 맞춤형 교육에 드는 이것은 무엇일까요?",앞글자 '과'
봉사시간,"다른 사람을 돕는 데 사용한 시간으로 사회공헌 활동의 척도가 되는 이것은 무엇일까요?",앞글자 '봉'
기부금,"사회에 도움이 되고자 자발적으로 내는 돈으로 나눔을 실천하는 이것은 무엇일까요?",앞글자 '기'
무료급식,"대가 없이 제공되는 급식으로 복지서비스의 하나인 이것은 무엇일까요?",앞글자 '무'
자선바자회,"물건을 팔아 얻은 수익금으로 어려운 이웃을 돕는 행사로 나눔의 장이 되는 이것은 무엇일까요?",앞글자 '자'
후원금,"지속적으로 도움을 주기 위해 정기적으로 내는 돈으로 사회공헌의 한 형태인 이것은 무엇일까요?",앞글자 '후'
저작권,"창작물에 대한 창작자의 권리로 지식재산을 보호하는 이것은 무엇일까요?",앞글자 '저'
특허,"새로운 발명이나 기술에 대한 독점적 권리로 혁신을 보호하는 이것은 무엇일까요?",앞글자 '특'
상표권,"상품의 로고나 이름에 대한 권리로 브랜드를 보호하는 이것은 무엇일까요?",앞글자 '상'
콘텐츠,"영상 음악 글 등의 창작물로 디지털 시대의 주요 상품이 되는 이것은 무엇일까요?",앞글자 '콘'
라이센스,"지식재산을 사용할 수 있는 권리로 합법적 이용을 가능하게 하는 이것은 무엇일까요?",앞글자 '라'
복권,"당첨되면 상금을 받을 수 있는 티켓으로 행운을 기대하게 하는 이것은 무엇일까요?",앞글자 '복'
경품,"행사나 이벤트에서 주는 상품으로 마케팅 수단으로 활용되는 이것은 무엇일까요?",앞글자 '경'
당첨금,"복권이나 경품에 당첨되어 받는 상금으로 행운의 결과인 이것은 무엇일까요?",앞글자 '당'
상금,"대회나 공모전에서 수상하여 받는 돈으로 성과에 대한 보상인 이것은 무엇일까요?",앞글자 '상'
보너스,"정규 급여 외에 추가로 지급되는 돈으로 특별한 보상인 이것은 무엇일까요?",앞글자 '보'
알뜰교통카드,"대중교통 이용 시 할인혜택을 주는 카드로 교통비 절약에 도움되는 이것은 무엇일까요?",앞글자 '알'
주유비,"자동차의 연료를 넣는데 드는 비용으로 운전에 필수적인 이것은 무엇일까요?",앞글자 '주'
주차비,"자동차를 주차장에 세워두는 비용으로 도심에서 꼭 필요한 이것은 무엇일까요?",앞글자 '주'
택시비,"택시를 이용할 때 지불하는 요금으로 미터기로 계산되는 이것은 무엇일까요?",앞글자 '택'
교통카드,"대중교통을 이용할 때 사용하는 선불카드로 편리한 지불수단인 이것은 무엇일까요?",앞글자 '교'
계절할인,"특정 계절에 상품을 싸게 파는 것으로 시즌 오프의 대표적인 이것은 무엇일까요?",앞글자 '계'
할인점,"상품을 정상가보다 싸게 파는 매장으로 대량구매로 가격을 낮춘 이것은 무엇일까요?",앞글자 '할'
세일,"상품의 가격을 일시적으로 낮추어 파는 것으로 판매촉진을 위한 이것은 무엇일까요?",앞글자 '세'
이월상품,"지난 시즌의 상품을 할인해서 파는 것으로 재고처리를 위한 이것은 무엇일까요?",앞글자 '이'
특가,"특별히 낮은 가격으로 제공되는 상품으로 파격적인 할인가의 이것은 무엇일까요?",앞글자 '특'
출판,"책을 만들어 파는 일로 지식과 정보를 전달하는 이것은 무엇일까요?",앞글자 '출'
인쇄비,"글이나 그림을 종이에 찍어내는 비용으로 출판과정에 필요한 이것은 무엇일까요?",앞글자 '인'
원고료,"글을 써서 받는 대가로 저작물 창작의 보상인 이것은 무엇일까요?",앞글자 '원'
도서비,"책을 구입하는데 드는 비용으로 독서를 위해 필요한 이것은 무엇일까요?",앞글자 '도'
독자,"책을 읽는 사람으로 출판물의 소비자인 이것은 무엇일까요?",앞글자 '독'
전자책,"디지털 형태로 제공되는 책으로 온라인으로 읽을 수 있는 이것은 무엇일까요?",앞글자 '전'
도서관,"책을 빌려 읽을 수 있는 곳으로 지식의 보고인 이것은 무엇일까요?",앞글자 '도'
